{
  "schema_version": "forge-evaluation-request.v1",
  "request_id": "forge-001",
  "created_at": "2026-08-10T18:03:00Z",
  "ruleset_version": "commander-2026-02-09",
  "card_snapshot_id": "cards-2026-08-10",
  "decks": [
    {
      "seat_key": "A",
      "deck_id": "fixture-deck-001",
      "deck_fingerprint": "1111111111111111111111111111111111111111111111111111111111111111",
      "command_zone": [
        {
          "oracle_id": "11111111-1111-4111-8111-111111111111",
          "quantity": 1
        }
      ],
      "mainboard": [
        {
          "oracle_id": "22222222-2222-4222-8222-222222222222",
          "quantity": 1
        },
        {
          "oracle_id": "33333333-3333-4333-8333-333333333333",
          "quantity": 1
        },
        {
          "oracle_id": "44444444-4444-4444-8444-444444444444",
          "quantity": 1
        },
        {
          "oracle_id": "23ff33c3-9dd4-5bc1-a3dc-55b334ac0dca",
          "quantity": 38
        },
        {
          "oracle_id": "77777777-7777-4777-8777-777777777777",
          "quantity": 58
        }
      ]
    },
    {
      "seat_key": "B",
      "deck_id": "fixture-deck-002",
      "deck_fingerprint": "2222222222222222222222222222222222222222222222222222222222222222",
      "command_zone": [
        {
          "oracle_id": "55555555-5555-4555-8555-555555555555",
          "quantity": 1
        }
      ],
      "mainboard": [
        {
          "oracle_id": "66666666-6666-4666-8666-666666666666",
          "quantity": 1
        },
        {
          "oracle_id": "23ff33c3-9dd4-5bc1-a3dc-55b334ac0dca",
          "quantity": 38
        },
        {
          "oracle_id": "77777777-7777-4777-8777-777777777777",
          "quantity": 60
        }
      ]
    }
  ],
  "agent_ids": {
    "A": "forge-agent-baseline-v1",
    "B": "forge-agent-baseline-v1"
  },
  "games": [
    {
      "game_id": "game-001",
      "seed": 1729,
      "seat_order": [
        "A",
        "B"
      ],
      "max_turns": 200
    },
    {
      "game_id": "game-002",
      "seed": 1730,
      "seat_order": [
        "B",
        "A"
      ],
      "max_turns": 200
    }
  ],
  "forge_compatibility": {
    "minimum_bridge_version": "forge-file-v1",
    "required_forge_commit": null
  }
}
